MCQ,Choices,Correct
Who coined the term 'machine learning'?,a: Donald Hebb | b: Arthur Samuel | c: Walter Pitts | d: Warren McCulloch,b
What was the purpose of the 'Cybertron' machine?,a: To play checkers | b: To analyze sonar signals | c: To recognize characters | d: To predict stock prices,b
"According to Tom M. Mitchell's definition, what is the goal of machine learning?",a: To improve performance on tasks | b: To understand human cognitive processes | c: To create artificial intelligence | d: To classify data,a
What are the two main objectives of modern-day machine learning?,a: Classification and prediction | b: Pattern recognition and decision-making | c: Data analysis and visualization | d: Natural language processing and speech recognition,a
Which of the following is NOT a contribution to the development of machine learning?,a: Hebb's model of neurons | b: Pitts and McCulloch's mathematical models of neural networks | c: Turing's proposal to replace the question 'Can machines think?' | d: Einstein's theory of relativity,d
